{"schema":"nikodemus.deposition.v1","producer":{"id":"ethicalalt","version":"1a71460a9bbae62124f9cf774f25f4c05c0b1f61","constitution_version":"research_algorithm:sha256:95ddb90e2f8ab3a4"},"object":{"type":"profile_export","id":"exemplar-legacy-co"},"recorded_at":"2025-01-15T00:00:00.000Z","source_times":[{"kind":"updated_at","at":"2025-01-15T00:00:00.000Z","basis":"source_stated"}],"subject_refs":[{"ns":"ethicalalt:profile","id":"exemplar-legacy-co","label":"Exemplar Legacy Co"}],"payload_media_type":"application/json","payload_canonicalization":"RFC8785","payload_sha256":"d6876e4a8efcfeed16a50640414f73956b4a2e91d8383d134b2cdc2bb9203041","payload":{"schema_version":"ethicalalt.profile_export.v2","producer":"ethicalalt","profile":{"brand_slug":"exemplar-legacy-co","brand_name":"Exemplar Legacy Co","parent_company":null,"ultimate_parent":null,"known_subsidiaries":[],"profile_type":null,"overall_concern_level":"minor","concern_level_source":"incumbent_profiles.overall_concern_level","research_confidence":null,"research_depth":"legacy","researched_at":null,"last_researched":null,"updated_at":"2025-01-15T00:00:00.000Z","models":null,"corporate_tree":null},"methodology":{"research_algorithm_sha256":"95ddb90e2f8ab3a499d1d8966ed6b9ad38dbddfe52f2f7cd3e259598ad2f0bac","research_algorithm_path":"RESEARCH_ALGORITHM.md"},"categories":[],"incidents":[],"allegations":[],"gaps":[{"kind":"no_deep_research","note":"this profile has no structured deep-research incidents; its narrative sections are not exported as incidents"}],"provenance_completeness":{"research_depth":"legacy","incidents_total":0,"incidents_with_any_url":0,"incidents_with_direct_url":0,"incidents_with_official_source":0,"incidents_with_full_date":0,"incidents_with_amount":0,"incidents_with_agency":0,"unique_source_urls":0,"categories_run":0,"categories_capped":0,"allegation_response_documented":false,"note":"counts only — a signature proves who produced these bytes, not that every claim is true; a legacy profile is still legacy"},"vocabulary":{"attributed_to":"EthicalAlt (RESEARCH_ALGORITHM.md and the deep-research extraction contract)","concern_levels":{"significant":"multiple confirmed, high-severity matters across categories","moderate":"confirmed matters of limited scope or severity","critical":"as recorded in some profiles — the most severe band in the serve-time mapping","minor":"few or low-severity matters","clean":"no confirmed matters found in the categories researched","low":"as recorded in RESEARCH_ALGORITHM.md calibration","note":"the concern level is an EthicalAlt assessment, not an objective fact; the vocabulary varies across the corpus and is passed through as recorded"},"confidence":{"high":"primary or regulator source with a direct URL","medium":"established reporting","low":"uncited or single secondary source"},"source_types":["regulator","court","investigative_journalism","ngo","secondary_news"],"outcomes":["settlement","conviction","consent_decree","dismissed","ongoing","fine","recall","subsidy","other"],"allegation_response_types":{"1":"Type 1 — the organization responded substantively and the response is documented","2":"Type 2 — the organization responded but the response does not address the substance","3":"Type 3 — no documented response was found","note":"an allegation stays paired with its documented response classification; the pairing is EthicalAlt's"}}},"gaps":[{"kind":"no_deep_research","note":"this profile has no structured deep-research incidents; its narrative sections are not exported as incidents"}],"signature":{"algorithm":"Ed25519","method":"ethicalalt.export.v2","canonicalization":"RFC8785","signed_bytes":"jcs(payload)","trusted_key_id":"ed25519:sha256:2f517f32578a9bf51bc12d0a69ccd3a4d3eb8c5f5cf7942b2ad3d8e79d5db998","value":"ed25519:bXk0EF6wNtY2sX79mQMkjjMUoMvfxWAI8q86Zovbs_oHd1MCAmhQG86J42eQcwMS_1QAJaQVFkDg_BHcnTdMCQ","note":"verify under the key you pinned for this EthicalAlt; no key travels in this package"}}