{"schema":"nikodemus.deposition.v1","producer":{"id":"ethicalalt","version":"1a71460a9bbae62124f9cf774f25f4c05c0b1f61","constitution_version":"research_algorithm:sha256:95ddb90e2f8ab3a4"},"object":{"type":"profile_export","id":"exemplar-holdings"},"recorded_at":"2026-05-01T09:30:00.000Z","source_times":[{"kind":"researched_at","at":"2026-05-01T09:30:00.000Z","basis":"source_stated"},{"kind":"last_researched","at":"2026-05-01","basis":"source_stated"},{"kind":"updated_at","at":"2026-05-01T09:31:00.000Z","basis":"source_stated"}],"subject_refs":[{"ns":"ethicalalt:profile","id":"exemplar-holdings","label":"Exemplar Holdings"},{"ns":"ethicalalt:parent","id":"Exemplar Holdings","label":"Exemplar Holdings"},{"ns":"ethicalalt:ultimate_parent","id":"Exemplar Holdings","label":"Exemplar Holdings"}],"payload_media_type":"application/json","payload_canonicalization":"RFC8785","payload_sha256":"e195facebef079faa2c73ca69eab3683bbd87ef9fce340c68467b7f76a518cd0","payload":{"schema_version":"ethicalalt.profile_export.v2","producer":"ethicalalt","profile":{"brand_slug":"exemplar-holdings","brand_name":"Exemplar Holdings","parent_company":"Exemplar Holdings","ultimate_parent":"Exemplar Holdings","known_subsidiaries":["Exemplar Fleet Services LLC"],"profile_type":"database","overall_concern_level":"moderate","concern_level_source":"incumbent_profiles.overall_concern_level","research_confidence":"high","research_depth":"deep_research","researched_at":"2026-05-01T09:30:00.000Z","last_researched":"2026-05-01","updated_at":"2026-05-01T09:31:00.000Z","models":{"perplexity_primary":"sonar-deep-research","perplexity_effective":"sonar","claude":"claude-sonnet-4-6"},"corporate_tree":{"operating_entity":"Exemplar Fleet Services LLC","parent":"Exemplar Holdings","ultimate_parent":"Exemplar Holdings","dbas":[]}},"methodology":{"research_algorithm_sha256":"95ddb90e2f8ab3a499d1d8966ed6b9ad38dbddfe52f2f7cd3e259598ad2f0bac","research_algorithm_path":"RESEARCH_ALGORITHM.md"},"categories":[{"category":"environmental","total_found":5,"overflow_count":3,"incidents_exported":2},{"category":"labor_and_wage","total_found":2,"overflow_count":0,"incidents_exported":2}],"incidents":[{"incident_id":"ea_8729db9d7d276e107bd18f84","description":"State environmental agency entered a consent decree with Exemplar Fleet Services over diesel-particulate exceedances at the Springfield depot (fixture).","entity":"Exemplar Fleet Services LLC","parent_attribution":null,"date":"2026-04-28","date_precision":"day","categories":["environmental"],"action_type":"disposition","action_type_origin":"inferred","outcome":"consent_decree","amount_usd":310000,"currency":"USD","jurisdiction":"Indiana","agency_or_court":"Indiana Department of Environmental Management (fixture)","source_type":"regulator","confidence":"high","workers_affected":null,"sources":[{"url":"https://www.epa.example.gov/enforcement/exemplar-fleet-2026","domain":"epa.example.gov","label":"Indiana Department of Environmental Management (fixture)","authority_tier":"official","direct":true,"title":null,"publisher":null,"date":null}],"allegation":{"status":null,"response_type":null,"response_note":null},"canonical":true,"alternate_source_count":0,"category_placement_count":1},{"incident_id":"ea_b0f7fd7731ae7730978e9cc1","description":"A neighborhood association filed a complaint over stormwater runoff from the depot (fixture).","entity":"Exemplar Holdings","parent_attribution":null,"date":"2025-11","date_precision":"month","categories":["environmental"],"action_type":"regulator_action","action_type_origin":"inferred","outcome":"ongoing","amount_usd":null,"currency":null,"jurisdiction":"Indiana","agency_or_court":null,"source_type":"secondary_news","confidence":"medium","workers_affected":null,"sources":[{"url":"https://news.example.org/2025/11/exemplar-runoff-complaint","domain":"news.example.org","label":"Indiana","authority_tier":"secondary","direct":true,"title":null,"publisher":null,"date":null}],"allegation":{"status":null,"response_type":null,"response_note":null},"canonical":true,"alternate_source_count":0,"category_placement_count":1},{"incident_id":"ea_81c79a19c043d84267253370","description":"Wage-and-hour settlement covering 41 mechanics for unpaid pre-shift inspection time (fixture).","entity":"Exemplar Fleet Services LLC","parent_attribution":null,"date":"2025-08-19","date_precision":"day","categories":["labor_and_wage"],"action_type":"disposition","action_type_origin":"inferred","outcome":"settlement","amount_usd":88000,"currency":"USD","jurisdiction":"federal","agency_or_court":"U.S. Department of Labor, Wage and Hour Division (fixture)","source_type":"regulator","confidence":"high","workers_affected":41,"sources":[{"url":"https://www.dol.example.gov/whd/exemplar-settlement","domain":"dol.example.gov","label":"U.S. Department of Labor, Wage and Hour Division (fixture)","authority_tier":"official","direct":true,"title":null,"publisher":null,"date":null}],"allegation":{"status":null,"response_type":null,"response_note":null},"canonical":true,"alternate_source_count":0,"category_placement_count":1},{"incident_id":"ea_a25196150057c72acbcbffa3","description":"Reports of a retaliation claim by a former dispatcher; no filing located (fixture).","entity":"Exemplar Holdings","parent_attribution":null,"date":"","date_precision":"none","categories":["labor_and_wage"],"action_type":"contextual","action_type_origin":"inferred","outcome":"other","amount_usd":null,"currency":null,"jurisdiction":null,"agency_or_court":null,"source_type":"secondary_news","confidence":"low","workers_affected":null,"sources":[],"allegation":{"status":null,"response_type":null,"response_note":null},"canonical":false,"alternate_source_count":0,"category_placement_count":1}],"allegations":[{"allegation_id":"ealg_66e0f54f8cba45e48be54e67","summary":"A former dispatcher alleged retaliation after raising safety concerns; the company did not answer press inquiries. EthicalAlt allegation response type: Type 3 — no documented response found.","response_type":3,"response_label":"Type 3","response_note":"no documented response found.","sources":[{"url":"https://news.example.org/2026/02/exemplar-retaliation","domain":"news.example.org","direct":true}],"response_documented":true}],"gaps":[{"kind":"missing_source_url","incident_id":"ea_a25196150057c72acbcbffa3","note":"no source URL is recorded for this incident"},{"kind":"date_missing","incident_id":"ea_a25196150057c72acbcbffa3","note":"no date is recorded for this incident"},{"kind":"category_capped","category":"environmental","overflow_count":3,"note":"3 more matter(s) were found than exported for this category"},{"kind":"researcher_gap","note":"No SEC filings: Exemplar Holdings is privately held (fixture)."},{"kind":"researcher_gap","note":"Court records for 2019–2022 were not searched (fixture)."}],"provenance_completeness":{"research_depth":"deep_research","incidents_total":4,"incidents_with_any_url":3,"incidents_with_direct_url":3,"incidents_with_official_source":2,"incidents_with_full_date":2,"incidents_with_amount":2,"incidents_with_agency":2,"unique_source_urls":3,"categories_run":2,"categories_capped":1,"allegation_response_documented":true,"note":"counts only — a signature proves who produced these bytes, not that every claim is true; a legacy profile is still legacy"},"vocabulary":{"attributed_to":"EthicalAlt (RESEARCH_ALGORITHM.md and the deep-research extraction contract)","concern_levels":{"significant":"multiple confirmed, high-severity matters across categories","moderate":"confirmed matters of limited scope or severity","critical":"as recorded in some profiles — the most severe band in the serve-time mapping","minor":"few or low-severity matters","clean":"no confirmed matters found in the categories researched","low":"as recorded in RESEARCH_ALGORITHM.md calibration","note":"the concern level is an EthicalAlt assessment, not an objective fact; the vocabulary varies across the corpus and is passed through as recorded"},"confidence":{"high":"primary or regulator source with a direct URL","medium":"established reporting","low":"uncited or single secondary source"},"source_types":["regulator","court","investigative_journalism","ngo","secondary_news"],"outcomes":["settlement","conviction","consent_decree","dismissed","ongoing","fine","recall","subsidy","other"],"allegation_response_types":{"1":"Type 1 — the organization responded substantively and the response is documented","2":"Type 2 — the organization responded but the response does not address the substance","3":"Type 3 — no documented response was found","note":"an allegation stays paired with its documented response classification; the pairing is EthicalAlt's"}}},"gaps":[{"kind":"missing_source_url","incident_id":"ea_a25196150057c72acbcbffa3","note":"no source URL is recorded for this incident"},{"kind":"date_missing","incident_id":"ea_a25196150057c72acbcbffa3","note":"no date is recorded for this incident"},{"kind":"category_capped","category":"environmental","overflow_count":3,"note":"3 more matter(s) were found than exported for this category"},{"kind":"researcher_gap","note":"No SEC filings: Exemplar Holdings is privately held (fixture)."},{"kind":"researcher_gap","note":"Court records for 2019–2022 were not searched (fixture)."}],"signature":{"algorithm":"Ed25519","method":"ethicalalt.export.v2","canonicalization":"RFC8785","signed_bytes":"jcs(payload)","trusted_key_id":"ed25519:sha256:2f517f32578a9bf51bc12d0a69ccd3a4d3eb8c5f5cf7942b2ad3d8e79d5db998","value":"ed25519:MIfc0CuMz7-b1E0_rUdBRD_NJN3sFJxeO6pgubEgucn8SD6bq7wBKxdCSpIBCLnsJMkp6tt4BLeAs_8-RVO7AA","note":"verify under the key you pinned for this EthicalAlt; no key travels in this package"}}